{
  "$schema": "http://json-schema.org/draft-07/schema#",
  "title": "WASM ABI v1 Schema",
  "description": "Schema for Calimero WASM ABI v1 format",
  "type": "object",
  "additionalProperties": false,
  "required": ["schema_version", "types", "methods", "events"],
  "properties": {
    "schema_version": {
      "type": "string",
      "const": "wasm-abi/1"
    },
    "types": {
      "type": "object",
      "additionalProperties": {
        "$ref": "#/definitions/TypeDef"
      }
    },
    "methods": {
      "type": "array",
      "items": {
        "$ref": "#/definitions/Method"
      }
    },
    "events": {
      "type": "array",
      "items": {
        "$ref": "#/definitions/Event"
      }
    },
    "state_root": {
      "type": "string"
    },
    "state_version": {
      "type": "integer",
      "minimum": 1
    },
    "migrations": {
      "type": "array",
      "items": {
        "type": "object",
        "additionalProperties": false,
        "required": ["method", "fromVersion"],
        "properties": {
          "method": {
            "type": "string"
          },
          "fromVersion": {
            "type": "integer",
            "minimum": 1
          }
        }
      }
    }
  },
  "definitions": {
    "CrdtType": {
      "type": "string",
      "enum": [
        "lww_register",
        "counter",
        "vector",
        "unordered_map",
        "sorted_map",
        "authored_map",
        "authored_sorted_map",
        "unordered_set",
        "sorted_set",
        "replicated_growable_array",
        "fugue_text",
        "authored_vector",
        "shared_storage"
      ]
    },
    "TypeRef": {
      "oneOf": [
        {
          "type": "object",
          "additionalProperties": false,
          "required": ["$ref"],
          "properties": {
            "$ref": {
              "type": "string"
            }
          }
        },
        {
          "$ref": "#/definitions/ScalarType"
        },
        {
          "$ref": "#/definitions/BytesType"
        },
        {
          "$ref": "#/definitions/CollectionType"
        }
      ]
    },
    "ScalarType": {
      "type": "object",
      "additionalProperties": false,
      "required": ["kind"],
      "properties": {
        "kind": {
          "type": "string",
          "enum": [
            "bool",
            "i32",
            "i64",
            "u32",
            "u64",
            "f32",
            "f64",
            "string",
            "unit"
          ]
        }
      }
    },
    "BytesType": {
      "type": "object",
      "additionalProperties": false,
      "required": ["kind"],
      "properties": {
        "kind": {
          "const": "bytes"
        },
        "size": {
          "type": "integer",
          "minimum": 1
        },
        "encoding": {
          "type": "string"
        }
      }
    },
    "CollectionType": {
      "oneOf": [
        {
          "type": "object",
          "additionalProperties": false,
          "required": ["kind", "items"],
          "properties": {
            "kind": {
              "const": "list"
            },
            "items": {
              "$ref": "#/definitions/TypeRef"
            },
            "crdt_type": {
              "$ref": "#/definitions/CrdtType"
            }
          }
        },
        {
          "type": "object",
          "additionalProperties": false,
          "required": ["kind", "key", "value"],
          "properties": {
            "kind": {
              "const": "map"
            },
            "key": {
              "$ref": "#/definitions/TypeRef"
            },
            "value": {
              "$ref": "#/definitions/TypeRef"
            },
            "crdt_type": {
              "$ref": "#/definitions/CrdtType"
            }
          }
        },
        {
          "type": "object",
          "additionalProperties": false,
          "required": ["kind", "fields"],
          "properties": {
            "kind": {
              "const": "record"
            },
            "fields": {
              "type": "array",
              "items": {
                "$ref": "#/definitions/Field"
              }
            },
            "crdt_type": {
              "$ref": "#/definitions/CrdtType"
            },
            "inner_type": {
              "$ref": "#/definitions/TypeRef"
            }
          }
        },
        {
          "type": "object",
          "additionalProperties": false,
          "required": ["kind", "elements"],
          "properties": {
            "kind": {
              "const": "tuple"
            },
            "elements": {
              "type": "array",
              "items": {
                "$ref": "#/definitions/TypeRef"
              },
              "minItems": 1
            }
          }
        }
      ]
    },
    "Field": {
      "type": "object",
      "additionalProperties": false,
      "required": ["name", "type"],
      "properties": {
        "name": {
          "type": "string"
        },
        "type": {
          "$ref": "#/definitions/TypeRef"
        },
        "nullable": {
          "type": "boolean"
        },
        "doc": {
          "type": "string"
        }
      }
    },
    "Variant": {
      "type": "object",
      "additionalProperties": false,
      "required": ["name"],
      "properties": {
        "name": {
          "type": "string"
        },
        "code": {
          "type": "string"
        },
        "payload": {
          "$ref": "#/definitions/TypeRef"
        },
        "doc": {
          "type": "string"
        }
      }
    },
    "TypeDef": {
      "oneOf": [
        {
          "type": "object",
          "additionalProperties": false,
          "required": ["kind", "fields"],
          "properties": {
            "kind": {
              "const": "record"
            },
            "fields": {
              "type": "array",
              "items": {
                "$ref": "#/definitions/Field"
              }
            },
            "doc": {
              "type": "string"
            }
          }
        },
        {
          "type": "object",
          "additionalProperties": false,
          "required": ["kind", "variants"],
          "properties": {
            "kind": {
              "const": "variant"
            },
            "variants": {
              "type": "array",
              "items": {
                "$ref": "#/definitions/Variant"
              }
            },
            "doc": {
              "type": "string"
            }
          }
        },
        {
          "type": "object",
          "additionalProperties": false,
          "required": ["kind", "target"],
          "properties": {
            "kind": {
              "const": "alias"
            },
            "target": {
              "$ref": "#/definitions/TypeRef"
            },
            "pattern": {
              "type": "string",
              "format": "regex",
              "minLength": 1
            },
            "doc": {
              "type": "string"
            }
          }
        },
        {
          "type": "object",
          "additionalProperties": false,
          "required": ["kind"],
          "properties": {
            "kind": {
              "const": "bytes"
            },
            "size": {
              "type": "integer",
              "minimum": 1
            },
            "encoding": {
              "type": "string"
            },
            "doc": {
              "type": "string"
            }
          }
        }
      ]
    },
    "Parameter": {
      "type": "object",
      "additionalProperties": false,
      "required": ["name", "type"],
      "properties": {
        "name": {
          "type": "string"
        },
        "type": {
          "$ref": "#/definitions/TypeRef"
        },
        "nullable": {
          "type": "boolean"
        },
        "doc": {
          "type": "string"
        }
      }
    },
    "Error": {
      "type": "object",
      "additionalProperties": false,
      "required": ["code"],
      "properties": {
        "code": {
          "type": "string"
        },
        "payload": {
          "$ref": "#/definitions/TypeRef"
        }
      }
    },
    "Method": {
      "type": "object",
      "additionalProperties": false,
      "required": ["name", "params"],
      "properties": {
        "name": {
          "type": "string"
        },
        "params": {
          "type": "array",
          "items": {
            "$ref": "#/definitions/Parameter"
          }
        },
        "returns": {
          "$ref": "#/definitions/TypeRef"
        },
        "returns_nullable": {
          "type": "boolean"
        },
        "returns_doc": {
          "type": "string",
          "description": "What the return value means, from the method's # Returns doc section. Absent when there is none."
        },
        "errors": {
          "type": "array",
          "items": {
            "$ref": "#/definitions/Error"
          }
        },
        "intent": {
          "type": "string",
          "enum": ["read_only", "mutating", "unspecified"]
        },
        "xcall_callable": {
          "type": "boolean"
        },
        "xcall_callers": {
          "type": "string",
          "enum": ["any_in_namespace", "same_app"]
        },
        "tee_every_secs": {
          "type": "integer",
          "minimum": 1
        },
        "destructive": {
          "type": "boolean",
          "description": "Deletes or irreversibly overwrites data (#[app::destructive]). Emitted only when true; a hint, not enforced."
        },
        "idempotent": {
          "type": "boolean",
          "description": "Repeating the call with the same arguments has no further effect (#[app::idempotent]). Emitted only when true; a hint, not enforced."
        },
        "doc": {
          "type": "string"
        }
      }
    },
    "Event": {
      "type": "object",
      "additionalProperties": false,
      "required": ["name"],
      "properties": {
        "name": {
          "type": "string"
        },
        "payload": {
          "$ref": "#/definitions/TypeRef"
        },
        "doc": {
          "type": "string"
        }
      }
    }
  }
}
