{
  "schema_version": "wasm-abi/1",
  "types": {
    "Event_PingSent": {
      "kind": "record",
      "fields": [
        {
          "name": "to_context",
          "type": {
            "kind": "bytes",
            "size": 32
          }
        }
      ]
    },
    "Event_PongReceived": {
      "kind": "record",
      "fields": [
        {
          "name": "from_context",
          "type": {
            "kind": "bytes",
            "size": 32
          }
        },
        {
          "name": "counter",
          "type": {
            "kind": "u64"
          }
        }
      ]
    },
    "XCallExample": {
      "kind": "record",
      "fields": [
        {
          "name": "counter",
          "type": {
            "kind": "record",
            "fields": [],
            "crdt_type": "counter"
          }
        }
      ]
    }
  },
  "methods": [
    {
      "name": "init",
      "params": [],
      "returns": {
        "kind": "unit"
      }
    },
    {
      "name": "ping",
      "params": [
        {
          "name": "target_context",
          "type": {
            "kind": "bytes",
            "size": 32
          }
        }
      ],
      "returns": {
        "kind": "unit"
      }
    },
    {
      "name": "pong",
      "params": [
        {
          "name": "from_context",
          "type": {
            "kind": "bytes",
            "size": 32
          }
        }
      ],
      "returns": {
        "kind": "unit"
      }
    },
    {
      "name": "get_counter",
      "params": [],
      "returns": {
        "kind": "u64"
      }
    }
  ],
  "events": [
    {
      "name": "PingSent",
      "payload": {
        "$ref": "Event_PingSent"
      }
    },
    {
      "name": "PongReceived",
      "payload": {
        "$ref": "Event_PongReceived"
      }
    }
  ],
  "state_root": "XCallExample",
  "state_version": 1
}