{
  "schema_version": "wasm-abi/1",
  "types": {
    "Event_Inserted": {
      "kind": "record",
      "fields": [
        {
          "name": "key",
          "type": {
            "kind": "string"
          }
        },
        {
          "name": "value",
          "type": {
            "kind": "string"
          }
        }
      ]
    },
    "Event_Removed": {
      "kind": "record",
      "fields": [
        {
          "name": "key",
          "type": {
            "kind": "string"
          }
        }
      ]
    },
    "Event_Updated": {
      "kind": "record",
      "fields": [
        {
          "name": "key",
          "type": {
            "kind": "string"
          }
        },
        {
          "name": "value",
          "type": {
            "kind": "string"
          }
        }
      ]
    },
    "KvStore": {
      "kind": "record",
      "fields": [
        {
          "name": "items",
          "type": {
            "kind": "map",
            "key": {
              "kind": "string"
            },
            "value": {
              "kind": "record",
              "fields": [],
              "crdt_type": "lww_register",
              "inner_type": {
                "kind": "string"
              }
            },
            "crdt_type": "unordered_map"
          }
        },
        {
          "name": "handlers_called",
          "type": {
            "kind": "map",
            "key": {
              "kind": "string"
            },
            "value": {
              "kind": "record",
              "fields": [],
              "crdt_type": "lww_register",
              "inner_type": {
                "kind": "string"
              }
            },
            "crdt_type": "unordered_map"
          }
        },
        {
          "name": "handler_counter",
          "type": {
            "kind": "record",
            "fields": [],
            "crdt_type": "counter"
          }
        }
      ]
    }
  },
  "methods": [
    {
      "name": "init",
      "params": [],
      "returns": {
        "kind": "unit"
      }
    },
    {
      "name": "set",
      "params": [
        {
          "name": "key",
          "type": {
            "kind": "string"
          }
        },
        {
          "name": "value",
          "type": {
            "kind": "string"
          }
        }
      ],
      "returns": {
        "kind": "unit"
      }
    },
    {
      "name": "entries",
      "params": [],
      "returns": {
        "kind": "map",
        "key": {
          "kind": "string"
        },
        "value": {
          "kind": "string"
        }
      }
    },
    {
      "name": "len",
      "params": [],
      "returns": {
        "kind": "u32"
      }
    },
    {
      "name": "get",
      "params": [
        {
          "name": "key",
          "type": {
            "kind": "string"
          }
        }
      ],
      "returns": {
        "kind": "string"
      }
    },
    {
      "name": "get_unchecked",
      "params": [
        {
          "name": "key",
          "type": {
            "kind": "string"
          }
        }
      ],
      "returns": {
        "kind": "string"
      }
    },
    {
      "name": "get_result",
      "params": [
        {
          "name": "key",
          "type": {
            "kind": "string"
          }
        }
      ],
      "returns": {
        "kind": "string"
      }
    },
    {
      "name": "remove",
      "params": [
        {
          "name": "key",
          "type": {
            "kind": "string"
          }
        }
      ],
      "returns": {
        "kind": "string"
      }
    },
    {
      "name": "clear",
      "params": [],
      "returns": {
        "kind": "unit"
      }
    },
    {
      "name": "insert_handler",
      "params": [
        {
          "name": "key",
          "type": {
            "kind": "string"
          }
        },
        {
          "name": "value",
          "type": {
            "kind": "string"
          }
        }
      ],
      "returns": {
        "kind": "unit"
      }
    },
    {
      "name": "update_handler",
      "params": [
        {
          "name": "key",
          "type": {
            "kind": "string"
          }
        },
        {
          "name": "value",
          "type": {
            "kind": "string"
          }
        }
      ],
      "returns": {
        "kind": "unit"
      }
    },
    {
      "name": "remove_handler",
      "params": [
        {
          "name": "key",
          "type": {
            "kind": "string"
          }
        }
      ],
      "returns": {
        "kind": "unit"
      }
    },
    {
      "name": "clear_handler",
      "params": [],
      "returns": {
        "kind": "unit"
      }
    },
    {
      "name": "get_handler_execution_count",
      "params": [],
      "returns": {
        "kind": "u64"
      }
    },
    {
      "name": "get_handlers_called",
      "params": [],
      "returns": {
        "kind": "list",
        "items": {
          "kind": "string"
        }
      }
    },
    {
      "name": "get_unique_handlers_called",
      "params": [],
      "returns": {
        "kind": "list",
        "items": {
          "kind": "string"
        }
      }
    },
    {
      "name": "was_handler_called",
      "params": [
        {
          "name": "handler_name",
          "type": {
            "kind": "string"
          }
        }
      ],
      "returns": {
        "kind": "bool"
      }
    }
  ],
  "events": [
    {
      "name": "Inserted",
      "payload": {
        "$ref": "Event_Inserted"
      }
    },
    {
      "name": "Updated",
      "payload": {
        "$ref": "Event_Updated"
      }
    },
    {
      "name": "Removed",
      "payload": {
        "$ref": "Event_Removed"
      }
    },
    {
      "name": "Cleared"
    }
  ],
  "state_root": "KvStore",
  "state_version": 1
}