{
  "schema_version": "wasm-abi/1",
  "types": {
    "Entry": {
      "kind": "record",
      "fields": [
        {
          "name": "key",
          "type": {
            "kind": "string"
          }
        },
        {
          "name": "value",
          "type": {
            "kind": "string"
          }
        }
      ]
    },
    "Event_Inserted": {
      "kind": "record",
      "fields": [
        {
          "name": "key",
          "type": {
            "kind": "string"
          }
        },
        {
          "name": "value",
          "type": {
            "kind": "string"
          }
        }
      ]
    },
    "Event_Removed": {
      "kind": "record",
      "fields": [
        {
          "name": "key",
          "type": {
            "kind": "string"
          }
        }
      ]
    },
    "Event_Updated": {
      "kind": "record",
      "fields": [
        {
          "name": "key",
          "type": {
            "kind": "string"
          }
        },
        {
          "name": "value",
          "type": {
            "kind": "string"
          }
        }
      ]
    },
    "SortedKvStore": {
      "kind": "record",
      "fields": [
        {
          "name": "items",
          "type": {
            "kind": "map",
            "key": {
              "kind": "string"
            },
            "value": {
              "kind": "record",
              "fields": [],
              "crdt_type": "lww_register",
              "inner_type": {
                "kind": "string"
              }
            },
            "crdt_type": "sorted_map"
          }
        }
      ]
    }
  },
  "methods": [
    {
      "name": "init",
      "params": [],
      "returns": {
        "kind": "unit"
      }
    },
    {
      "name": "set",
      "params": [
        {
          "name": "key",
          "type": {
            "kind": "string"
          }
        },
        {
          "name": "value",
          "type": {
            "kind": "string"
          }
        }
      ],
      "returns": {
        "kind": "unit"
      }
    },
    {
      "name": "get",
      "params": [
        {
          "name": "key",
          "type": {
            "kind": "string"
          }
        }
      ],
      "returns": {
        "kind": "string"
      }
    },
    {
      "name": "get_result",
      "params": [
        {
          "name": "key",
          "type": {
            "kind": "string"
          }
        }
      ],
      "returns": {
        "kind": "string"
      }
    },
    {
      "name": "remove",
      "params": [
        {
          "name": "key",
          "type": {
            "kind": "string"
          }
        }
      ],
      "returns": {
        "kind": "string"
      }
    },
    {
      "name": "clear",
      "params": [],
      "returns": {
        "kind": "unit"
      }
    },
    {
      "name": "len",
      "params": [],
      "returns": {
        "kind": "u32"
      }
    },
    {
      "name": "is_empty",
      "params": [],
      "returns": {
        "kind": "bool"
      }
    },
    {
      "name": "entries",
      "params": [],
      "returns": {
        "kind": "map",
        "key": {
          "kind": "string"
        },
        "value": {
          "kind": "string"
        }
      }
    },
    {
      "name": "range",
      "params": [
        {
          "name": "start",
          "type": {
            "kind": "string"
          }
        },
        {
          "name": "end",
          "type": {
            "kind": "string"
          }
        }
      ],
      "returns": {
        "kind": "map",
        "key": {
          "kind": "string"
        },
        "value": {
          "kind": "string"
        }
      }
    },
    {
      "name": "prefix",
      "params": [
        {
          "name": "prefix",
          "type": {
            "kind": "string"
          }
        }
      ],
      "returns": {
        "kind": "map",
        "key": {
          "kind": "string"
        },
        "value": {
          "kind": "string"
        }
      }
    },
    {
      "name": "page",
      "params": [
        {
          "name": "offset",
          "type": {
            "kind": "u32"
          }
        },
        {
          "name": "limit",
          "type": {
            "kind": "u32"
          }
        }
      ],
      "returns": {
        "kind": "map",
        "key": {
          "kind": "string"
        },
        "value": {
          "kind": "string"
        }
      }
    },
    {
      "name": "first",
      "params": [],
      "returns": {
        "$ref": "Entry"
      }
    },
    {
      "name": "last",
      "params": [],
      "returns": {
        "$ref": "Entry"
      }
    }
  ],
  "events": [
    {
      "name": "Inserted",
      "payload": {
        "$ref": "Event_Inserted"
      }
    },
    {
      "name": "Updated",
      "payload": {
        "$ref": "Event_Updated"
      }
    },
    {
      "name": "Removed",
      "payload": {
        "$ref": "Event_Removed"
      }
    },
    {
      "name": "Cleared"
    }
  ],
  "state_root": "SortedKvStore",
  "state_version": 1
}