{
  "schema_version": "wasm-abi/1",
  "types": {
    "EditorState": {
      "kind": "record",
      "fields": [
        {
          "name": "document",
          "type": {
            "kind": "record",
            "fields": [],
            "crdt_type": "replicated_growable_array"
          }
        },
        {
          "name": "edit_count",
          "type": {
            "kind": "record",
            "fields": [],
            "crdt_type": "counter"
          }
        },
        {
          "name": "metadata",
          "type": {
            "kind": "map",
            "key": {
              "kind": "string"
            },
            "value": {
              "kind": "record",
              "fields": [],
              "crdt_type": "lww_register",
              "inner_type": {
                "kind": "string"
              }
            },
            "crdt_type": "unordered_map"
          }
        }
      ]
    }
  },
  "methods": [
    {
      "name": "init",
      "params": [],
      "returns": {
        "kind": "unit"
      }
    },
    {
      "name": "insert_text",
      "params": [
        {
          "name": "position",
          "type": {
            "kind": "u32"
          }
        },
        {
          "name": "text",
          "type": {
            "kind": "string"
          }
        }
      ],
      "returns": {
        "kind": "unit"
      }
    },
    {
      "name": "delete_text",
      "params": [
        {
          "name": "start",
          "type": {
            "kind": "u32"
          }
        },
        {
          "name": "end",
          "type": {
            "kind": "u32"
          }
        }
      ],
      "returns": {
        "kind": "unit"
      }
    },
    {
      "name": "get_text",
      "params": [],
      "returns": {
        "kind": "string"
      }
    },
    {
      "name": "get_length",
      "params": [],
      "returns": {
        "kind": "u32"
      }
    },
    {
      "name": "is_empty",
      "params": [],
      "returns": {
        "kind": "bool"
      }
    },
    {
      "name": "set_title",
      "params": [
        {
          "name": "new_title",
          "type": {
            "kind": "string"
          }
        }
      ],
      "returns": {
        "kind": "unit"
      }
    },
    {
      "name": "get_title",
      "params": [],
      "returns": {
        "kind": "string"
      }
    },
    {
      "name": "get_stats",
      "params": [],
      "returns": {
        "kind": "string"
      }
    },
    {
      "name": "replace_text",
      "params": [
        {
          "name": "start",
          "type": {
            "kind": "u32"
          }
        },
        {
          "name": "end",
          "type": {
            "kind": "u32"
          }
        },
        {
          "name": "text",
          "type": {
            "kind": "string"
          }
        }
      ],
      "returns": {
        "kind": "unit"
      }
    },
    {
      "name": "append_text",
      "params": [
        {
          "name": "text",
          "type": {
            "kind": "string"
          }
        }
      ],
      "returns": {
        "kind": "unit"
      }
    },
    {
      "name": "clear",
      "params": [],
      "returns": {
        "kind": "unit"
      }
    }
  ],
  "events": [],
  "state_root": "EditorState",
  "state_version": 1
}