{
  "schema_version": "wasm-abi/1",
  "types": {
    "ComponentsDemo": {
      "kind": "record",
      "fields": [
        {
          "name": "config",
          "type": {
            "kind": "record",
            "fields": [],
            "crdt_type": "shared_storage",
            "inner_type": {
              "kind": "record",
              "fields": [],
              "crdt_type": "lww_register",
              "inner_type": {
                "kind": "string"
              }
            }
          }
        },
        {
          "name": "settings",
          "type": {
            "kind": "record",
            "fields": [],
            "crdt_type": "shared_storage",
            "inner_type": {
              "kind": "map",
              "key": {
                "kind": "string"
              },
              "value": {
                "kind": "record",
                "fields": [],
                "crdt_type": "lww_register",
                "inner_type": {
                  "kind": "string"
                }
              },
              "crdt_type": "unordered_map"
            }
          }
        },
        {
          "name": "roles",
          "type": {
            "kind": "map",
            "key": {
              "kind": "string"
            },
            "value": {
              "kind": "bool"
            },
            "crdt_type": "shared_storage"
          }
        }
      ]
    }
  },
  "methods": [
    {
      "name": "init",
      "params": [],
      "returns": {
        "kind": "unit"
      }
    },
    {
      "name": "grant_role",
      "params": [
        {
          "name": "role",
          "type": {
            "kind": "string"
          }
        },
        {
          "name": "who",
          "type": {
            "kind": "bytes",
            "size": 32
          }
        }
      ],
      "returns": {
        "kind": "unit"
      }
    },
    {
      "name": "revoke_role",
      "params": [
        {
          "name": "role",
          "type": {
            "kind": "string"
          }
        },
        {
          "name": "who",
          "type": {
            "kind": "bytes",
            "size": 32
          }
        }
      ],
      "returns": {
        "kind": "unit"
      }
    },
    {
      "name": "has_role",
      "params": [
        {
          "name": "role",
          "type": {
            "kind": "string"
          }
        },
        {
          "name": "who",
          "type": {
            "kind": "bytes",
            "size": 32
          }
        }
      ],
      "returns": {
        "kind": "bool"
      }
    },
    {
      "name": "try_grant_role",
      "params": [
        {
          "name": "role",
          "type": {
            "kind": "string"
          }
        },
        {
          "name": "who",
          "type": {
            "kind": "bytes",
            "size": 32
          }
        }
      ],
      "returns": {
        "kind": "bool"
      }
    },
    {
      "name": "set_config",
      "params": [
        {
          "name": "value",
          "type": {
            "kind": "string"
          }
        }
      ],
      "returns": {
        "kind": "unit"
      }
    },
    {
      "name": "get_config",
      "params": [],
      "returns": {
        "kind": "string"
      }
    },
    {
      "name": "owner",
      "params": [],
      "returns": {
        "kind": "bytes",
        "size": 32
      }
    },
    {
      "name": "transfer",
      "params": [
        {
          "name": "new_owner",
          "type": {
            "kind": "bytes",
            "size": 32
          }
        }
      ],
      "returns": {
        "kind": "unit"
      }
    },
    {
      "name": "settings_set",
      "params": [
        {
          "name": "key",
          "type": {
            "kind": "string"
          }
        },
        {
          "name": "value",
          "type": {
            "kind": "string"
          }
        }
      ],
      "returns": {
        "kind": "unit"
      }
    },
    {
      "name": "settings_get",
      "params": [
        {
          "name": "key",
          "type": {
            "kind": "string"
          }
        }
      ],
      "returns": {
        "kind": "string"
      }
    }
  ],
  "events": [],
  "state_root": "ComponentsDemo",
  "state_version": 1
}