{
  "schema_version": "wasm-abi/1",
  "types": {
    "Event_FrozenAdded": {
      "kind": "record",
      "fields": [
        {
          "name": "hash",
          "type": {
            "kind": "bytes",
            "size": 32
          }
        },
        {
          "name": "value",
          "type": {
            "kind": "string"
          }
        }
      ]
    },
    "Event_Inserted": {
      "kind": "record",
      "fields": [
        {
          "name": "key",
          "type": {
            "kind": "string"
          }
        },
        {
          "name": "value",
          "type": {
            "kind": "string"
          }
        }
      ]
    },
    "Event_Removed": {
      "kind": "record",
      "fields": [
        {
          "name": "key",
          "type": {
            "kind": "string"
          }
        }
      ]
    },
    "Event_Updated": {
      "kind": "record",
      "fields": [
        {
          "name": "key",
          "type": {
            "kind": "string"
          }
        },
        {
          "name": "value",
          "type": {
            "kind": "string"
          }
        }
      ]
    },
    "Event_UserNestedSet": {
      "kind": "record",
      "fields": [
        {
          "name": "executor_id",
          "type": {
            "kind": "bytes",
            "size": 32
          }
        },
        {
          "name": "key",
          "type": {
            "kind": "string"
          }
        },
        {
          "name": "value",
          "type": {
            "kind": "string"
          }
        }
      ]
    },
    "Event_UserSimpleSet": {
      "kind": "record",
      "fields": [
        {
          "name": "executor_id",
          "type": {
            "kind": "bytes",
            "size": 32
          }
        },
        {
          "name": "value",
          "type": {
            "kind": "string"
          }
        }
      ]
    },
    "KvStore": {
      "kind": "record",
      "fields": [
        {
          "name": "items",
          "type": {
            "kind": "map",
            "key": {
              "kind": "string"
            },
            "value": {
              "kind": "record",
              "fields": [],
              "crdt_type": "lww_register",
              "inner_type": {
                "kind": "string"
              }
            },
            "crdt_type": "unordered_map"
          }
        },
        {
          "name": "user_items_simple",
          "type": {
            "kind": "map",
            "key": {
              "kind": "string"
            },
            "value": {
              "kind": "record",
              "fields": [],
              "crdt_type": "lww_register",
              "inner_type": {
                "kind": "string"
              }
            }
          }
        },
        {
          "name": "user_items_nested",
          "type": {
            "kind": "map",
            "key": {
              "kind": "string"
            },
            "value": {
              "$ref": "NestedMap"
            }
          }
        },
        {
          "name": "frozen_items",
          "type": {
            "kind": "map",
            "key": {
              "kind": "string"
            },
            "value": {
              "kind": "string"
            }
          }
        }
      ]
    },
    "NestedMap": {
      "kind": "record",
      "fields": [
        {
          "name": "map",
          "type": {
            "kind": "map",
            "key": {
              "kind": "string"
            },
            "value": {
              "kind": "record",
              "fields": [],
              "crdt_type": "lww_register",
              "inner_type": {
                "kind": "string"
              }
            },
            "crdt_type": "unordered_map"
          }
        }
      ]
    }
  },
  "methods": [
    {
      "name": "init",
      "params": [],
      "returns": {
        "kind": "unit"
      }
    },
    {
      "name": "set",
      "params": [
        {
          "name": "key",
          "type": {
            "kind": "string"
          }
        },
        {
          "name": "value",
          "type": {
            "kind": "string"
          }
        }
      ],
      "returns": {
        "kind": "unit"
      }
    },
    {
      "name": "get",
      "params": [
        {
          "name": "key",
          "type": {
            "kind": "string"
          }
        }
      ],
      "returns": {
        "kind": "string"
      }
    },
    {
      "name": "set_user_simple",
      "params": [
        {
          "name": "value",
          "type": {
            "kind": "string"
          }
        }
      ],
      "returns": {
        "kind": "unit"
      }
    },
    {
      "name": "get_user_simple",
      "params": [],
      "returns": {
        "kind": "string"
      }
    },
    {
      "name": "get_user_simple_for",
      "params": [
        {
          "name": "user_key",
          "type": {
            "kind": "bytes",
            "size": 32
          }
        }
      ],
      "returns": {
        "kind": "string"
      }
    },
    {
      "name": "set_user_nested",
      "params": [
        {
          "name": "key",
          "type": {
            "kind": "string"
          }
        },
        {
          "name": "value",
          "type": {
            "kind": "string"
          }
        }
      ],
      "returns": {
        "kind": "unit"
      }
    },
    {
      "name": "get_user_nested",
      "params": [
        {
          "name": "key",
          "type": {
            "kind": "string"
          }
        }
      ],
      "returns": {
        "kind": "string"
      }
    },
    {
      "name": "add_frozen",
      "params": [
        {
          "name": "value",
          "type": {
            "kind": "string"
          }
        }
      ],
      "returns": {
        "kind": "string"
      }
    },
    {
      "name": "get_frozen",
      "params": [
        {
          "name": "hash_hex",
          "type": {
            "kind": "string"
          }
        }
      ],
      "returns": {
        "kind": "string"
      }
    },
    {
      "name": "entries",
      "params": [],
      "returns": {
        "kind": "map",
        "key": {
          "kind": "string"
        },
        "value": {
          "kind": "string"
        }
      }
    },
    {
      "name": "len",
      "params": [],
      "returns": {
        "kind": "u32"
      }
    },
    {
      "name": "get_unchecked",
      "params": [
        {
          "name": "key",
          "type": {
            "kind": "string"
          }
        }
      ],
      "returns": {
        "kind": "string"
      }
    },
    {
      "name": "get_result",
      "params": [
        {
          "name": "key",
          "type": {
            "kind": "string"
          }
        }
      ],
      "returns": {
        "kind": "string"
      }
    },
    {
      "name": "remove",
      "params": [
        {
          "name": "key",
          "type": {
            "kind": "string"
          }
        }
      ],
      "returns": {
        "kind": "string"
      }
    },
    {
      "name": "clear",
      "params": [],
      "returns": {
        "kind": "unit"
      }
    }
  ],
  "events": [
    {
      "name": "Inserted",
      "payload": {
        "$ref": "Event_Inserted"
      }
    },
    {
      "name": "Updated",
      "payload": {
        "$ref": "Event_Updated"
      }
    },
    {
      "name": "Removed",
      "payload": {
        "$ref": "Event_Removed"
      }
    },
    {
      "name": "Cleared"
    },
    {
      "name": "UserSimpleSet",
      "payload": {
        "$ref": "Event_UserSimpleSet"
      }
    },
    {
      "name": "UserNestedSet",
      "payload": {
        "$ref": "Event_UserNestedSet"
      }
    },
    {
      "name": "FrozenAdded",
      "payload": {
        "$ref": "Event_FrozenAdded"
      }
    }
  ],
  "state_root": "KvStore",
  "state_version": 1
}