{
  "schema_version": "wasm-abi/1",
  "types": {
    "Event_SharedSet": {
      "kind": "record",
      "fields": [
        {
          "name": "value",
          "type": {
            "kind": "string"
          }
        }
      ]
    },
    "Event_WritersRotated": {
      "kind": "record",
      "fields": [
        {
          "name": "count",
          "type": {
            "kind": "u32"
          }
        }
      ]
    },
    "KvStore": {
      "kind": "record",
      "fields": [
        {
          "name": "shared_value",
          "type": {
            "kind": "record",
            "fields": [],
            "crdt_type": "shared_storage",
            "inner_type": {
              "kind": "record",
              "fields": [],
              "crdt_type": "lww_register",
              "inner_type": {
                "kind": "string"
              }
            }
          }
        },
        {
          "name": "shared_map",
          "type": {
            "kind": "record",
            "fields": [],
            "crdt_type": "shared_storage",
            "inner_type": {
              "kind": "map",
              "key": {
                "kind": "string"
              },
              "value": {
                "kind": "record",
                "fields": [],
                "crdt_type": "lww_register",
                "inner_type": {
                  "kind": "string"
                }
              },
              "crdt_type": "unordered_map"
            }
          }
        }
      ]
    }
  },
  "methods": [
    {
      "name": "init",
      "params": [],
      "returns": {
        "kind": "unit"
      }
    },
    {
      "name": "set_shared",
      "params": [
        {
          "name": "value",
          "type": {
            "kind": "string"
          }
        }
      ],
      "returns": {
        "kind": "unit"
      }
    },
    {
      "name": "get_shared",
      "params": [],
      "returns": {
        "kind": "string"
      }
    },
    {
      "name": "map_set",
      "params": [
        {
          "name": "key",
          "type": {
            "kind": "string"
          }
        },
        {
          "name": "value",
          "type": {
            "kind": "string"
          }
        }
      ],
      "returns": {
        "kind": "unit"
      }
    },
    {
      "name": "map_get",
      "params": [
        {
          "name": "key",
          "type": {
            "kind": "string"
          }
        }
      ],
      "returns": {
        "kind": "string"
      }
    },
    {
      "name": "rotate_writers",
      "params": [
        {
          "name": "new_writers",
          "type": {
            "kind": "list",
            "items": {
              "kind": "bytes",
              "size": 32
            }
          }
        }
      ],
      "returns": {
        "kind": "unit"
      }
    },
    {
      "name": "writer_count",
      "params": [],
      "returns": {
        "kind": "u64"
      }
    },
    {
      "name": "try_rotate_writers",
      "params": [
        {
          "name": "new_writers",
          "type": {
            "kind": "list",
            "items": {
              "kind": "bytes",
              "size": 32
            }
          }
        }
      ],
      "returns": {
        "kind": "bool"
      }
    }
  ],
  "events": [
    {
      "name": "SharedSet",
      "payload": {
        "$ref": "Event_SharedSet"
      }
    },
    {
      "name": "WritersRotated",
      "payload": {
        "$ref": "Event_WritersRotated"
      }
    }
  ],
  "state_root": "KvStore",
  "state_version": 1
}